{
    "Name": "Vortex8",
    "Manufacturer": "Creamsource",
    "Image": "https://creamsource.com/wp-content/uploads/2024/01/vortex8s_ip65_1080p.mp4",
    "Manual": "https://knowledge.creamsource.com",
    "Dimensions": {
        "Weight": 39.2,
        "Height": 21.7,
        "Width": 32.7,
        "Depth": 6.4
    },
    "Power": {
        "AC_voltage": "100-240V",
        "Power_Draw": 650,
        "DC_Port": "3-Pin XLR",
        "DC_voltage": "48V",
        "AC_plug": "Edison",
        "USB_Port": true,
        "Internal_battery": false
    },
    "Optics": {
        "Beam_Angle": "20\u00b0",
        "Color_Temp": "2200K-15000K",
        "Source": "LED",
        "LED_Array": "RGBW",
        "Color": true,
        "Pixel_count": 8,
        "Lens": "20\u00b0 Native, 110\u00b0 With Diffusion"
    },
    "Control": {
        "CRMX": true,
        "RDM": true,
        "Ethernet": true,
        "5_Pin_DMX": true,
        "3_Pin_DMX": false
    },
    "Physical": {
        "mount": "Junior Pin",
        "IP_Rating": "IP65"
    }
}