{
    "Name": "Q5 Color",
    "Manufacturer": "Fiilex",
    "Image": "https://www.fiilex.com/products/Q5_Color.php",
    "Manual": "https://www.fiilex.com/downloads/Q5_Color_Manual.pdf",
    "Dimensions": {
        "Weight": 7.3,
        "Height": 15.7,
        "Width": 11.1,
        "Depth": 7.8
    },
    "Power": {
        "AC_voltage": "100-240V AC, 50-60Hz",
        "Power_Draw": 175,
        "DC_Port": "XLR-3",
        "DC_voltage": "24-48V DC",
        "AC_plug": "powerCON TRUE1",
        "USB_Port": true,
        "Internal_battery": false
    },
    "Optics": {
        "Beam_Angle": "12\u00b0-55\u00b0 (80\u00b0 without fresnel)",
        "Color_Temp": "2000-10000K",
        "Source": "LED",
        "LED_Array": "RGBW",
        "Color": true,
        "Pixel_count": 1,
        "Lens": "5 inch Fresnel"
    },
    "Control": {
        "CRMX": false,
        "RDM": true,
        "Ethernet": false,
        "5_Pin_DMX": true,
        "3_Pin_DMX": false
    },
    "Physical": {
        "mount": "Combo (baby stud female / junior stud male)",
        "IP_Rating": "IP-X5"
    }
}