{
    "Name": "Q3 Color",
    "Manufacturer": "Fiilex",
    "Image": "https://www.fiilex.com/products/Q3_Color.php",
    "Manual": "https://www.fiilex.com/downloads/Q3_Color_Manual.pdf",
    "Dimensions": {
        "Weight": 4.5,
        "Height": 5.7,
        "Width": 6.8,
        "Depth": 9
    },
    "Power": {
        "AC_voltage": "100-240V AC, 50-60Hz",
        "Power_Draw": 90,
        "DC_Port": "5.5mm x 2.5mm Barrel",
        "DC_voltage": "14-30V DC",
        "AC_plug": "Standard Plug",
        "USB_Port": true,
        "Internal_battery": false
    },
    "Optics": {
        "Beam_Angle": "15\u00b0-45\u00b0 (55\u00b0 without fresnel)",
        "Color_Temp": "2000-10000K",
        "Source": "LED",
        "LED_Array": "RGBW",
        "Color": true,
        "Pixel_count": 1,
        "Lens": "5 inch Fresnel"
    },
    "Control": {
        "CRMX": true,
        "RDM": true,
        "Ethernet": false,
        "5_Pin_DMX": true,
        "3_Pin_DMX": false
    },
    "Physical": {
        "mount": "5/8\" receiver",
        "IP_Rating": "IP-X5"
    }
}