{
    "Name": "Orbiter",
    "Manufacturer": "ARRI",
    "Image": "https://www.arri.com/resource/image/1169042/portrait_ratio1x1/300/300/6bc7524be40a2a11d59f1227f8584d9a/dY/orbiter-introduction-main-05.png",
    "Manual": "https://www.arri.com/resource/blob/169364/ca6d0cbd6cfe05c25f72f49b0f3fc65e/orbiter-operating-manual-en-data.pdf",
    "Dimensions": {
        "Weight": 25.8,
        "Height": 15.6,
        "Width": 14.8,
        "Depth": 9.6
    },
    "Power": {
        "AC_voltage": "100-240V",
        "Power_Draw": 400,
        "DC_Port": "3-pin XLR",
        "DC_voltage": "48V",
        "AC_plug": "PowerCon TRUE1",
        "USB_Port": true,
        "Internal_battery": false
    },
    "Optics": {
        "Beam_Angle": "80\u00b0",
        "Color_Temp": "2000K - 20000K",
        "Source": "LED",
        "LED_Array": "RGBACL",
        "Color": true,
        "Pixel_count": 1,
        "Lens": "Various lenses available"
    },
    "Control": {
        "CRMX": true,
        "RDM": true,
        "Ethernet": true,
        "5_Pin_DMX": true,
        "3_Pin_DMX": false
    },
    "Physical": {
        "mount": "Junior Pin",
        "IP_Rating": "IP20"
    }
}